rule,compliant,evidence,missing_if_any,suggestion
Contract must specify Liability limitations or caps.,True,"['EXCEPT FOR EITHER PARTY’S VIOLATION OF THE CONFIDENTIALITY OBLIGATIONS ANDFOR EITHER PARTY’S INDEMNIFICATION OBLIGATIONS, NEITHER PARTY SHALL BE LIABLE UNDERANY CONTRACT, NEGLIGENCE, STRICT LIABILITY, OR OTHER LEGAL OR EQUITABLE THEORY FORANY AMOUNTS IN EXCESS IN THE AGGREGATE OF THE AMOUNT OF THE FEES PAID OR PAYABLEUNDER THIS AGREEMENT.', 'EXCEPT FOR EITHER PARTY’S VIOLATION OF THE CONFIDENTIALITY OBLIGATIONS ANDFOR EITHER PARTY’S INDEMNIFICATION OBLIGATIONS, IN NO EVENT WILL EITHER PARTY BELIABLE FOR SPECIAL, INCIDENTAL, CONSEQUENTIAL, INDIRECT OR PUNITIVE DAMAGES, OR LOSTPROFITS, REGARDLESS OF WHETHER SUCH LIABILITY IS BASED ON BREACH OF CONTRACT,TORT, STRICT LIABILITY, BREACH OF WARRANTIES, FAILURE OF ESSENTIAL PURPOSE OROTHERWISE AND EVEN IF ADVISED OF THE POSSIBILITY OF SUCH DAMAGES.', 'In no event will either Party be liable to the other Party under this Agreement for any consequential, indirect, special, incidental, punitive or exemplary loss or damage, including, without limitation, business interruption, cost of capital, loss of anticipated revenues and profits, loss of goodwill or increased operating costs, whether arising from contract, warranty, tort, strict liability or otherwise regardless of whether the possibility of such losses or damages have been made known to the first Party, and each Party hereby expressly waives all such rights and remedies, except for breach of any confidentiality or restricted use provisions of this Agreement and except as provided in Paragraph 11.04 (Exceptions to Limitations of Liability).', 'EXCEPT IN THE EVENT OF A BREACH OF SECTION 8 (CONFIDENTIALITY) OR LIABILITY ARISING UNDER A PARTY’S INDEMNIFICATION OBLIGATIONS UNDER SECTION 12, IN NO EVENT SHALL EITHER PARTY BE LIABLE FOR ANY INDIRECT, SPECIAL, INCIDENTAL, PUNITIVE OR CONSEQUENTIAL DAMAGES ARISING OUT OF OR IN ANY WAY CONNECTED WITH THIS AGREEMENT OR ANY MATTER RELATED HERETO, INCLUDING WITHOUT LIMITATION, LOST BUSINESS OR LOST PROFITS, EVEN IF SUCH PARTY HAS BEEN ADVISED OF THE POSSIBILITY OF SUCH DAMAGES.', 'EXCEPT FOR BREACHES OF SECTION 11 OR BREACHES OF ANY LICENSE GRANT SET FORTH IN THIS AGREEMENT, IN NO EVENT WILL EITHER PARTY BE LIABLE TO THE OTHER FOR ANY SPECIAL, INCIDENTAL, INDIRECT OR CONSEQUENTIAL DAMAGES, WHETHER BASED ON BREACH OF CONTRACT, TORT (INCLUDING NEGLIGENCE) OR OTHERWISE, WHETHER OR NOT THAT PARTY HAS BEEN ADVISED OF, KNEW, OR SHOULD HAVE KNOWN OF, THE POSSIBILITY OF SUCH DAMAGE AND NOTWITHSTANDING THE FAILURE OF ESSENTIAL PURPOSE OF ANY LIMITED REMEDY.', 'MONEY PAID TO CISCO FOR PRODUCTS OR FOR SERVICES, SEPARATELY AND AS APPLICABLE, UNDER THIS AGREEMENT DURING THE [*****] PERIOD PRECEDING THE EVENT OR CIRCUMSTANCES FIRST GIVING RISE TO SUCH LIABILITY. THESE LIMITATIONS OF LIABILITY FOR PRODUCT AND SERVICES ARE CUMULATIVE AND NOT PER-INCIDENT (I.E., THE EXISTENCE OF TWO OR MORE CLAIMS WILL NOT ENLARGE THIS LIMIT).', ""EXCEPT FOR LIABILITY ARISING OUT OF OR IN CONNECTION WITH DISTRIBUTOR'S BREACH OF SECTION 9 (PROPRIETARY RIGHTS AND SOFTWARE LICENSING) OR EXHIBIT C (SOFTWARE LICENSE AGREEMENT), IN NO EVENT SHALL EITHER PARTY, ITS RESPECTIVE AFFILIATES, OFFICERS, DIRECTORS, EMPLOYEES, AGENTS OR SUPPLIERS BE LIABLE FOR ANY SPECIAL, INCIDENTAL, CONSEQUENTIAL,"", ""Licensor's total liability to Licensee under any provision of this Agreement shall be limited to the amount actually paid by Licensee to Licensor for the Licensed Product giving rise to the liability."", 'IN NO EVENT SHALL A PARTY TO THIS AGREEMENT BE LIABLE TO THE OTHER PARTY TO THIS AGREEMENT FOR ANY SPECIAL, INDIRECT,', 'IN NO EVENT SHALL EITHER PARTY BE LIABLE TO THE OTHER FOR ANY INCIDENTAL, CONSEQUENTIAL, SPECIAL OR PUNITIVE DAMAGES OF ANY KIND OR NATURE ARISING OUT OF THIS AGREEMENT OR THE SALE OF PRODUCTS, WHETHER SUCH LIABILITY IS ASSERTED ON THE BASIS OF CONTRACT, TORT (INCLUDING THE POSSIBILITY OF NEGLIGENCE OR STRICT LIABILITY), OR OTHERWISE, EVEN IF THE PARTY HAS BEEN WARNED OF THE POSSIBILITY OF ANY SUCH LOSS OR DAMAGE.']",None,None required
Contract must include Warranties and Warranty Duration.,True,"['10. Express Limited Warranty\nFor the purpose of this Agreement, “Warranty Period” shall mean twelve (12) months as of the date of delivery to Customer. Contractor\nrepresents and warrants that, for the Warranty Period, the Products (i) will be free from defects in workmanship, material (only to the same\nextent as the original manufacturer of the material warrants the Contractor), and manufacture; (ii) will comply the Specifications IPC610.B\nstandard (in all material respects and unless otherwise was instructed by Customer). Contractor further represents and warrants that the\nProduct will consist of new materials.', 'Limited Warranty\nCisco warrants that commencing from the date of shipment to Customer (but in case of resale by an authorized Cisco reseller, commencing not more\nthan ninety (90) days after original shipment by Cisco), and continuing for a period of the longer of (a) ninety (90) days or (b) the software\nwarranty period (if any) set forth in the warranty card accompanying the Product (if any): (a) the media on which the Software is furnished will be\nfree of defects in materials and workmanship under normal use; and (b) the Software substantially conforms to its published specifications.']",None,None required
Contract must include Termination or Termination for Convenience clause.,True,"['Term and Termination. This Agreement shall commence on the Effective Date and continue in full force and effect until the end of the fifteenth (15th) Contract Year, and shall continue in full force and effect thereafter until terminated by either Party by providing thirty (30) calendar days’ prior written notice of termination to the other Party (such fifteen (15) Contract Year period, as may be further extended as provided herein is referred to as the “Term”).', 'If any of the foregoing conditions have not been met at the Closing Time, the Agents may terminate their obligations under this Agreement without prejudice to any other remedies they may have and the Agents shall have the right on behalf of the Subscribers to withdraw all Subscription Agreements delivered and not previously withdrawn by Subscribers.', '10. Rights of Termination (a) Regulatory Proceedings Out If, after the date hereof and prior to the Closing Time, any enquiry, action, suit, investigation or other proceeding, whether formal or informal, is instituted or announced or any order is made by any federal, provincial or other Governmental Authority in relation to the Corporation which, in the opinion of any of the Agents, operates to prevent or restrict the distribution or', '8.2.5 in exercising its right to terminate this Agreement pursuant to Subsections 8.2.1 to 8.2.4, one Party shall give a written notice of termination to the other Party, without the necessity of obtaining consent from the other Party, and this Agreement shall terminate as of the date on which such written notice is served to the other Party. 8.3 No compensation or indemnification will be required to be made by one Party to the other Party when one Party exercises its right to terminate this Agreement unilaterally pursuant to this Article Eight and no rights or interests of the terminating Party will be adversely affected by the termination of this Agreement.']",None,None required
Contract must include Audit Rights or post-termination responsibilities.,True,"['8. AUDIT RIGHTS (a) Ehave Right to Audit CHT will provide Ehave and its representatives, auditors and inspectors ("" Auditors"") upon ten (10) Business Days prior written notice with reasonable access, during business hours, to all facilities, systems and assets used by CHT, to CHT personnel and subcontractors and to all relevant CHT books and records, in each case, to the extent relevant to this Agreement, in order to conduct appropriate audits, examinations and inspections ("" Audits"") to: (i) verify compliance with the requirements set out in this Agreement; and (ii) verify the Royalty calculations.', '9. POST-TERMINATION RIGHTS a. Talent agrees that Company shall, for a period of nine (9) months (Sell-Off Period) following the effective date of termination, have the right to continue to sell Product bearing the Property and/or utilize advertising materials and collateral bearing the Property. Such sales and use shall be made subject to all the provisions of this Agreement and in particular clause 4 hereof.', 'Section 11.1 AUDITS. During the term of this Agreement and the five (5) year period immediately following termination of this Agreement, Licensor will have the right, at its own expense, to audit and examine Licensees records concerning either (a) the reproduction and sublicensing of the Licensed Products and the resulting fees due to Licensor or (b) compliance by Licensee with its obligations as to confidentiality under this Agreement.', 'In the event of any such termination, there shall be no further liability on the part of the Agents to the Corporation or on the part of the Corporation to the Agents except in respect of any liability which may have arisen prior to or arise after such termination under Sections 11, 12 and 14.', 'Any rights and obligations that have accrued to either Party against the other prior to the effective date of termination or expiration of this Agreement in any respect will survive such termination or expiration, and rights that have accrued to an Affiliate of a Party will continue regardless of any change in Affiliate status during the Term of this Agreement or thereafter.']",None,None required
"Contract must include Insurance requirements, if applicable.",True,"['11. Insurance. 11.1 Requirements to Maintain. During the Term, Manufacturer shall self-insure or shall provide and maintain such insurance coverage, in minimum types and amounts as described below in this Section 11.', '11.2 Amounts and Limits. The insurance required under this Section 11 shall be written for not less than any limits of liability specified herein or as required by applicable Law, whichever is greater. All insurance carriers shall have a minimum of “A-” A.M. Best rating. Manufacturer shall have the right to provide the total limits required by any combination of self-insurance, primary and umbrella/excess coverage; said insurance to include the following: (a) Insurance for liability under the workers’ compensation or occupational disease Laws of any state of the United States (or be a qualified self-insurer in those states of the United States) or otherwise applicable with respect to Persons performing the services and employer’s liability insurance covering all claims by or in respect to the employees of Manufacturer, providing: (i) Coverage for the statutory limits of all claims under the applicable State Workers’ Compensation Act or Acts.', '13. Insurance: During the term of this Agreement, and before any sponsorship or promotional activities are conducted under this Agreement, Company shall obtain and maintain at its expense, Commercial General Liability Insurance coverage with an insurance carrier with a Best’s rating of A+. The insurance shall be in an amount of: $2,000,000 per occurrence and $2,000,000 aggregate with a $2,000,000 aggregate for products and completed operations. The Association must be a named additional insured, and shall be provided at least 30 days’ notice for cancellation of policy and 10 days’ notice for non-payment of premium. Such insurance shall be primary and non-contributory.', '3.18 Insurance (a) With respect to Vendor’s performance under this Agreement, and in addition to Vendor’s obligation to indemnify, Vendor shall at its sole cost and expense: (i) maintain the insurance coverages and limits required by this Section and any additional insurance and/or bonds required by Laws:', '(c) The insurance coverage required by this Section includes: (i) Workers’ Compensation insurance with benefits afforded under the laws of any state in which the Work is to be performed and Employers Liability insurance with limits of at least: $500,000 for Bodily Injury – each accident $500,000 for Bodily Injury by disease – policy limits $500,000 for Bodily Injury by disease – each employee', '6.19.3. Requirements for Construction and Renovation . In connection with any construction, renovation, refurbishment, or remodeling of the Premises, you must cause the general contractor to maintain commercial general liability insurance (with comprehensive automobile liability coverage for both owned and non-owned vehicles, builder’s risk, product liability, and independent contractors coverage) with a reputable insurer. Such insurance must be in the amount of at least $1,000,000 and must name us and you as an additional named insured party, as our respective interests may appear. You must also cause the general contractor to maintain workers’ compensation and employer’s liability insurance as may be required by law.', '11.6 Insurance. Each Party shall obtain and carry in full force and effect the minimum insurance requirements set forth herein. Such insurance (a) shall be primary insurance with respect to each Party’s own participation under this Agreement, (b) shall be issued by a recognized insurer rated by A.M. Best “A-VII” (or its equivalent) or better, or an insurer pre-approved in writing by the other Party, and (c) shall list the other Party as an additional insured under the General Liability Policy. 11.6.1 Types and Minimum Limits. The types of insurance, and minimum limits shall be: (a) Worker’s Compensation with statutory limits in compliance with the Worker’s', '22.10 Insurance. Customer specifically agrees to maintain insurance coverage for any finished Products or materials which passes to Customer pursuant to this Agreement and which is stored on the premises of Contractor.']",None,None required
